Наименование;Описание
Конструкция и назначение люнета неподвижного токарно-винторезных станков модели 16К40;"Люнет неподвижный предназначен для поддержки обрабатываемой детали при точении длинномерных заготовок. Основные элементы конструкции: корпус, служащий основой устройства и обеспечивающий крепление остальных элементов; центры подвижные, располагающиеся симметрично относительно центра заготовки и обеспечивающие фиксацию детали по диаметру; рычаги регулировки центров, позволяющие точно устанавливать положение центров для оптимального прижима и стабильной работы при обработке деталей с высокими треб"
Концевые переключатели (концевики) (для промышленного оборудования и станков);Используются на промышленном оборудовании и станках. Служат для отключения (блокировки) на кожухах станков и т.д. на перемещения подвижных частей станка и промышленного оборудования.
Коробка подач в сборе станков мод. 1М63;Коробка подач в сборе предназначена для управления скоростями продольной и поперечной подачи токарно-винторезного станка 1М63. Содержит полный набор шестерен и механизмов для изменения подачи в зависимости от типа обрабатываемого материала и требуемого режима резания.
Кронштейн задний для станков;Крепежная деталь для станков токарно-винторезных, применяется в конструкции станков серии 1М63 и аналогичных моделей. Обеспечивает надежное крепление и позиционирование элементов станка.
Кронштейн насоса токарно-винторезных станков 1М63,1М63Н,ДИП300;Кронштейн насоса токарно-винторезного станка моделей 1М63, 1М63Н, ДИП300 представляет собой конструктивный элемент, обеспечивающий надежное крепление гидравлического оборудования (насоса) к корпусной части станка. Основная функция данного элемента заключается в обеспечении устойчивого положения агрегата и предотвращении его смещения при работе, что обеспечивает стабильную подачу смазочно-охлаждающей жидкости (СОЖ) и оптимальный режим обработки деталей.
Кронштейн перемещения задней бабки станков 1Н65;Кронштейн предназначен для крепления и направления перемещения задней бабки на продольных направляющих токарного станка. Обеспечивает точное позиционирование и надежную фиксацию при работе станка.
Кронштейн телефонная трубка фартука станков;Применяется в фартуках в качестве соединительной детали станков токарно-винторезных. Изготавливается из чугуна литьевым методом, обеспечивая надежное соединение компонентов фартука.
Кулачки для план шайб станков 1512,1516;Кулачки для план шайб станков моделей 1512, 1516 предназначены для крепления и позиционирования обрабатываемых деталей в токарно-карусельных станках. Изделия обеспечивают надежную фиксацию заготовок и точное позиционирование при выполнении операций обработки. Кулачки изготавливаются из высокопрочной стали и обеспечивают стабильную работу механизма зажима при длительной эксплуатации и высоких нагрузках при обработке крупногабаритных деталей различного назначения.
Кулачки для токарных патронов ф. 1000мм. и 1250мм.;Кулачки предназначены для зажима и удержания деталей в больших токарных патронах диаметром 1000 и 1250 мм. Обеспечивают надежное крепление заготовок при обработке на токарных станках при различных режимах резания.
Кулачки зажима колесной пары для колесотокарных станков мод.КЗТС1836;Кулачки зажима предназначены для надежного закрепления колесных пар железнодорожных вагонов и локомотивов на колесотокарном станке модели КЗТС1836. Обеспечивают точное центрирование и безопасное удержание детали при обработке.
Кулачок концевик продольного перемещения фартука для станков 1Н983;Кулачок-концевик предназначен для ограничения продольного перемещения фартука токарного станка 1Н983 и срабатывания соответствующих элементов управления. Обеспечивает безопасную работу оборудования путем отключения подач при достижении крайних положений.
Кулачок малый левый;предназначен для зажима деталей в токарных патронах. Работает в комплекте с другими кулачками для обеспечения надежного центрального закрепления заготовок при обработке на станках.
Кулачок сектор зубчатый левый;Кулачок-сектор с зубчатым профилем предназначен для зажима деталей в револьверных головках и специальных приспособлениях. Обеспечивает надежное удержание при обработке на высоких скоростях вращения.
Лента тормозная, вилка карболит для токарно-винторезных станков мод. 16К20, 1К62;Лента тормозная, вилка карболит применяется в шпиндельной бабке и фартуке станка и служит для взаимодействия узлов токарно-винторезных станков моделей 16К20, 1К62. Лента изготавливается из карболитового материала, обеспечивающего надежное торможение при высоких нагрузках. Компоненты обеспечивают точное управление остановом шпинделя, стабильную работу механизма торможения и безопасность при выполнении токарных операций.
Лимб (в сборе: нониус, кольцо, ось и т.д.) токарно-винторезного станка мод. 1К62;Лимб в сборе, включающий нониус, кольцо, ось и другие компоненты, применяется в фартуке станка и служит для перемещения фартука и суппортной части токарно-винторезного станка модели 1К62 в продольном направлении. Компоненты изготавливаются из высокопрочной стали и обеспечивают точное позиционирование инструмента, высокую точность отсчета перемещений и надежную работу механизма подачи при выполнении различных токарных операций обработки деталей.
Линейные опоры качения роликовые;Опоры качения (РС) предназначены для применения в направляющих металлорежущих станков, роботизированных комплексов, контрольно-измерительных приборов, воспринимают высокие нагрузки, действующие перпендикулярно плоскости перемещения, позволяют перемещать исполнительные органы с неограниченной величиной хода.
Люнет напольный, отдельно стоящий для станков мод. 1Н983,1А983,1М983,РТ983, СА983;Применяется совместно со специальными трубообрабатывающими станками мод. 1Н983, 1А983, 1М983, РТ983, СА983, устанавливается отдельно от станка, служит для поддержки заготовок и труб больших длин при обработке на станках, литой чугунный.
Магнит револьверной головки 1П756ДФ3.40.000;Применяется в резцедержателе 4-х позиционной револьверной головки станков специальных с ЧПУ мод. 1П756ДФ3, используется в качестве запасной части.
Манжета револьверной головки 1П756ДФ3.39.000;Манжета предназначена для уплотнения и защиты внутренних механизмов револьверной головки 1П756ДФ3 от попадания стружки и охлаждающей жидкости. Обеспечивает герметичность узла при циклическом вращении головки.
Маслоуказатели (глазки) для токарных;Маслоуказатели предназначены для визуального контроля уровня смазочного масла в картере и коробке передач токарных станков. Обеспечивают оперативный мониторинг смазки и предотвращают работу механизма при недостаточном уровне масла.
Маточная гайка для станков 1М63;Маточная гайка предназначена для преобразования вращательного движения в поступательное при работе ходового винта станка. Обеспечивает точное перемещение суппорта и каретки при нарезании резьбы и выполнении продольных подач на токарных станках.
Маточная гайка для станков 1Н983.60.110 для станков 1Н983;Маточная гайка предназначена для преобразования вращательного движения в поступательное при работе ходового винта станка. Обеспечивает точное перемещение суппорта и каретки при нарезании резьбы и выполнении продольных подач.
Маточная гайка для станков мод. 1М63;Маточная гайка предназначена для передачи движения от ходового винта к фартуку токарно-винторезного станка 1М63. Обеспечивает точное и плавное движение при продольной и поперечной подаче инструмента во время обработки деталей.
Маточная гайка для токарно-винторезных станков;Применяется в фартуках токарно-винторезных станков в качестве запасной части, через которую проходит ходовой винт. Может поставляться как отдельно в виде разрезной бронзовой гайки, состоящей из двух полугаек, так и в комплекте с чугунным корпусом.
Маточная гайка для токарно-винторезных станков мод. 1М65;Маточная гайка предназначена для преобразования вращательного движения в поступательное при работе ходового винта станка. Обеспечивает точное перемещение суппорта при нарезании резьбы и выполнении подач инструмента.
Микропереключатели для Револьверных Головок 1П756ДФ3, 16М30Ф3, 16К30Ф3;Применяется в резцедержателях (в 4-х позиционных и 8-ми позиционных револьверных головках 1П756ДФ3.39.000, 1П756ДФ3.40.000, 16М30Ф3.40.000, 16К30Ф3.40.000), станков специальных с ЧПУ мод. 1П756ДФ3, 16М30Ф3, 16К30Ф3 используется в качестве запасной части. Применяется для переключения режимов револьверных головок.
Муфта обгонная 1М63.06.900 для станков производства Тбилиси z-66;о зубьев z-66. Используется на токарных станках для регулирования числа оборотов ходового вала станка.
Муфта обгонная 1Н65.60.900 (Для станков 165 ДИП500 1М65 1Н65);Муфта обгонная предназначена для передачи вращения в одном направлении и защиты передачи от перегрузок при работе станка. Обеспечивает безопасное отключение при превышении допустимого крутящего момента.
Муфта обгонная 1Н65.60.900СБ;состоит из следующих основных элементов: ведущий (наружный) корпус, ведомый (внутренний) барабан, ролики или шарики с пружинами, обеспечивающие сцепление и расцепление валов, сепаратор роликов/шариков, уплотнения и подшипники для защиты от загрязнений и обеспечения надежной работы. Муфта предназначена для передачи крутящего момента между валами при одном направлении вращения и свободном вращении при другом, обеспечивая стабильную работу станочного оборудования и защиту узлов от перегрузок.
Муфта токарно-винторезного станка мод. 16К20;Муфта применяется в шпиндельной бабке станка токарно-винторезного модели 16К20 в качестве запасной части. Муфта служит для соединения валов и передачи крутящего момента в системе привода шпинделя. Изделие изготавливается из высокопрочной стали и обеспечивает надежную передачу мощности, точное взаимодействие механизмов и стабильную работу системы при выполнении различных токарных операций обработки деталей.
Муфта электромагнитная Э11М 106-2А для станков 1Н983 1А983 1М983;Муфта электромагнитная предназначена для управления включением и отключением шпинделя специальных трубообрабатывающих станков. Обеспечивает электромагнитное управление вращением при различных режимах обработки труб и специальных деталей.
Муфты обгонные для станков 1М63Н;Муфты обгонные предназначены для передачи вращения в одном направлении и защиты механизма от перегрузок. Обеспечивают автоматическое отключение при обратном вращении или превышении допустимого крутящего момента.
Накатные ролики для промышленного оборудования;Накатные ролики предназначены для упрочнения и сглаживания поверхностей деталей методом поверхностного пластического деформирования. Применяются на специальных токарно-накатных станках для обработки железнодорожных осей и деталей высокой ответственности.
Насос плунжерный 1К62.02.076 (в сборе) для токарно-винторезного станка мод. 1К62;Насос плунжерный 1К62.02.076 в сборе предназначен для использования в шпиндельной бабке токарно-винторезного станка модели 1К62. Служит для подачи масла к узлам и механизмам и осуществления работы и взаимодействия механизмов фартука станка. Поставляется в полной сборке и готов к установке на станок. Насос обеспечивает стабильную подачу смазочного материала, надежное функционирование всей гидравлической системы и оптимальный режим обработки при выполнении токарных операций.
Ножи к ножницам по металлу гильотин;Ножи предназначены для резки листового и профильного металла на гильотинных ножницах. Обеспечивают чистый и ровный срез листового материала при работе промышленного оборудования в различных цехах.
Нониусы (лимбы) продольной подачи для станков 1М65, 1Н65, ДИП500, РТ117, РТ817, 165;Нониусы (лимбы) продольной подачи применяются на токарно-винторезных станках моделей 1М65, 1Н65, ДИП500, РТ117, РТ817, 165 и предназначены для точного позиционирования и измерения перемещения суппорта вдоль оси станка. Изделия обеспечивают высокую точность отсчета перемещений инструмента и стабильную работу механизма подачи. Нониусы изготавливаются из высокопрочной стали и обеспечивают надежную работу при длительной эксплуатации станочного оборудования при выполнении токарных операций.
Нониусы лимбы для станков мод. 16Р25П и т.д.;Нониусы (лимбы) предназначены для точного позиционирования и отсчета перемещений фартука и поперечного суппорта токарно-револьверного станка 16Р25П. Обеспечивают высокую точность установки размеров при обработке деталей.
Нониусы лимбы для станков мод. 1М63;Нониусы (лимбы) предназначены для точного позиционирования фартука и суппорта на токарно-винторезном станке 1М63. Обеспечивают высокую точность установки размеров при обработке деталей различных диаметров.
Нониусы лимбы поперечной подачи для станков 1М65;Нониусы (лимбы) поперечной подачи предназначены для перемещения каретки и суппортной части станка в процессе работы оборудования при изготовлении деталей на станке. Применяется в каретке станка и служит для точного позиционирования инструмента.
Пара винт гайка вертикального суппорта для токарно-карусельного станка мод. 1516Ф1;Пара винт гайка вертикального суппорта карусельных станков применяется в суппортах станков модели 1510, 1512, 1512Ф1, 1516, 1516Ф1, 1525, 1532, 1541 и т.д. для вертикального перемещения верхнего суппорта. Пара включает винт и две гайки и предназначена для надежной передачи движения при позиционировании резца относительно обрабатываемой детали. Изделие обеспечивает точное перемещение, стабильность работы и надежность функционирования механизма подачи при обработке крупногабаритных деталей.
Патрон 3-х кулачковый ф.250мм. с комплектом обратных кулачков 3шт. 3-250.35.11.004;Трехкулачковый патрон диаметром 250 мм с полным комплектом обратных кулачков предназначен для крепления и удержания деталей на станках токарного типа. Обеспечивает надежный центральный зажим при обработке деталей различных конфигураций.
Переходная втулка с Морзе6 на Морзе5 (1М63, 1М63Н и т.д.) в заднюю бабку токарных станков;Применяется в токарно-винторезных станках, устанавливается в заднюю бабку для перехода с конус Морзе 6 на Конус Морзе 5, используется совместно с центрами.
Пиноли накатного устройства станка РТ30101 РТ301;Пиноли предназначены для удержания и направления инструмента в накатном устройстве специального токарного станка модели РТ30101 (РТ301). Обеспечивают точное позиционирование при выполнении операции накатки на деталях.
