Наименование;Описание
Головка электромеханическая ЭМГ-50 для фрезерных;Головка электромеханическая ЭМГ-50 предназначена для автоматизации управления и позиционирования на фрезерных станках. Обеспечивает электромеханическое управление ходом каретки и коллектив движения инструмента во время обработки деталей.
Диск инструментальный 1П756ДФ3.47.000 Для Револьверной головки 1П756ДФ3.39.000 станка 1П756ДФ3;Диск инструментальный применяется в революольверной головке 1П756ДФ3.39.000 станка 1П756ДФ3 в качестве запасной части служит для установки и крепления режущего инструмента.
Диски индексирующие для карусельных станков 1512,1516,1525;Применяется в качестве запасной части в специальных карусельно-токарных станках 1512, 1516, 1525, поставляются комплектом, от 2-х шт., так и единично, каленые.
Диски фрикционные (6-ти и 8-ми шлицевые) для станков и промышленного оборудования;Диски фрикционные предназначены для передачи крутящего момента в муфтах сцепления станков и промышленного оборудования. Обеспечивают плавное включение и отключение привода при различных режимах работы и защищают механизм от перегрузок.
Диски фрикционные 1М63.21.387 и 1М63.21.388 для станков 1М63;Диски фрикционные предназначены для обеспечения фрикционной передачи крутящего момента в механизме привода главного шпинделя токарно-винторезного станка 1М63. Обеспечивают мягкое включение и плавную работу передачи при различных режимах.
Диски фрикционные для кран балок;Диски фрикционные предназначены для передачи крутящего момента в муфтах сцепления кран-балок и подъемного оборудования. Обеспечивают плавное включение и защиту механизма от перегрузок при работе.
Диски фрикционные для станков 16Р25П;Диски фрикционные предназначены для фрикционной передачи крутящего момента в механизмах привода токарно-револьверного станка 16Р25П. Обеспечивают мягкое включение-отключение передач и регулировку скоростей при переходе между режимами работы.
Задняя бабка гидравлическая в комплекте с мостиком станков с ЧПУ 16К30Ф3;Шпиндельные бабки (коробки скоростей), коробки подач, верхние суппорта, ползушки, каретки, фартука, задние бабки (включая мостики): изготовление с нулевого цикла, начиная с литья корпусов - комплектация узлов: шестерни, шлицевые валы, подшипники, вилки, шпинделя и т.д. по капитальному ремонту и модернизации полная замена внутренних составляющих соответственно (шестерни, шлицевые валы, подшипники, расточка корпусов, шлифовка, общая сборка узлов).
Запасные части для Револьверных головок РГ УГ 9326 блок зубчатых колёс УГ9311.0200.53;Блок зубчатых колес предназначен для замены в револьверной головке типа РГ-УГ 9326. Обеспечивает передачу крутящего момента для синхронизации вращения револьверной головки и переключения позиций инструмента.
Запасные части для резцедержателей 1М65,1Н65,ДИП500,РТ117,РТ817;Каталог продукции включает следующие позиции: вилки штока поворотного, шпонки клиновые под инструментальные блоки (патроны), втулки регулировочные различных типоразмеров, направляющие и вкладыши каретки, оправки специальные для крепления инструмента. Продукция изготовлена из высокопрочных материалов и обеспечивает надежное крепление и точное позиционирование режущего инструмента при обработке деталей на всех этапах производства.
Запасные части для станков (Муфта электромагнитная Э144-2А в сборе с поводком-коронкой);Муфта электромагнитная Э144-2А в сборе с поводком-коронкой используется для включения и отключения шпинделя станка. Обеспечивает безопасное и надежное управление вращением шпинделя при обработке деталей на токарно-винторезных станках.
Запасные части для станков 1М63;Запасные части для токарно-винторезных станков модели 1М63. Полный ассортимент комплектующих для ремонта и восстановления узлов и механизмов станка. Все детали производятся по оригинальным чертежам с высокой точностью.
Запасные части для станков- муфта электромагнитная ЭТМ 096-2А в комплекте с дисками;Применяется в качестве запасной части электрической цепи для токарно-винторезных станков, прессов, фрезерных станков, сверлильных и шлифовальных станков. Применяются как отдельно так и с поводком-коронкой.
Запасные части для фрезерных станков FU-450 вал-шестерня FU-400.15.10.327;Вал-шестерня предназначен для замены в фрезерном станке модели FU-450. Обеспечивает передачу крутящего момента в кинематической цепи привода главного шпинделя при фрезеровании деталей.
Запасные части для фрезерных станков и станков с ЧПУ;Запасные части предназначены для обслуживания и ремонта фрезерных станков и станков с числовым программным управлением. Используются при замене изношенных деталей для восстановления первоначальной производительности и точности оборудования.
Запасные части к токарным станкам;Запасные части предназначены для обслуживания и ремонта токарных станков различных моделей. Используются при замене изношенных деталей для восстановления работоспособности оборудования и повышения его надежности.
Захват инструмента 6Т13МФ4-1.37.271 для фрезерных станков;Захват инструмента предназначен для надежного закрепления режущего инструмента в шпинделе фрезерного станка. Обеспечивает точное центрирование инструмента и его надежную фиксацию при выполнении операций фрезерования с высокой скоростью вращения.
Зубчатое колесо пятой оси m-4;предназначено для трансмиссии шпиндельной бабки токарно-винторезных станков. Обеспечивает передачу крутящего момента на пятую координатную ось при обработке многоосевых деталей.
Зубчатое колесо пятой оси m-4 z-49 1А64.02.349 (Для станков 1М65 1Н65 ДИП500 165);Зубчатое колесо пятой оси m-4 z-49 1А64.02.349 предназначено для трансмиссии шпиндельной бабки токарно-винторезных станков моделей 1М65, 1Н65, ДИП500, 165. Обеспечивает передачу крутящего момента на пятую координатную ось.
Зубчатое колесо третьей оси m-4 z-35 1А64.02.848 (Для станков 1М65 1Н65 ДИП500 165);Зубчатое колесо третьей оси m-4 z-35 1А64.02.848 предназначено для трансмиссии шпиндельной бабки токарно-винторезных станков моделей 1М65, 1Н65, ДИП500, 165. Обеспечивает передачу крутящего момента на третью ось.
Зубчатое колесо третьей оси m-6 z-18 1А64.02.865 (Для станков 1М65 1Н65 ДИП500 165);Зубчатое колесо третьей оси m-6 z-18 1А64.02.865 предназначено для трансмиссии шпиндельной бабки токарно-винторезных станков моделей 1М65, 1Н65, ДИП500, 165. Обеспечивает передачу крутящего момента на третью координатную ось.
Зубчатое колесо шпинделя m-5 z-75 Для станков 1М65 1Н65 ДИП500 165 РТ117 РТ817;Применяется в шпиндельной бабке устанавливается на шпиндель станка внутренняя посадка ф. 185мм.Н7, на шпонку (термообработанная, зубошлифованная).
Изготовление конических шестерен с круговым зубом;Конические пары с прямым и круговым зубом до 6 класса точности до m-26, D- 2 500 мм (в т.ч. гипоидные пары). Конические зубчатые передачи представляют собой механизм, который состоит из скрепленных колес с зубьями. Их применяют для преобразования крутящих моментов и угловых скоростей для передачи вращательного движения. Конические пары необходимы, когда пересекаются приводные валы и нужно передать вращательное движение. Гипоидная передача (гиперболоидная) - вид винтовой зубчатой передачи со скре
Изготовление пружин различных типов и конфигурации;Пружины изготавливаются различных типов и конфигураций для применения в механизмах токарных станков и промышленного оборудования. Используются для накопления энергии, амортизации и обеспечения упругого возврата элементов конструкции.
Изготовление пружин различных типов и конфигурации (пружины сжатия);Пружины сжатия предназначены для амортизации, накопления энергии и обеспечения упругого возврата элементов механизмов при работе станков и промышленного оборудования. Используются в различных узлах и механизмах для обеспечения надежной работы.
Изготовление пружин различных типов и конфигурации большие типоразмеры;Пружины большого типоразмера предназначены для использования в мощных механизмах и оборудовании, требующих значительных упругих усилий. Используются в буферных системах, амортизаторах и других узлах промышленного оборудования.
Изготовление шарико-винтовых пар класса точности П3;Шарико-винтовая передача – преобразует вращательное движение вала в линейное движение узла. Движение осуществляется за счет возвратно-поступательного перемещения шариков между винтовыми поверхностями винта и гайки при повороте одного из элементов пары. Шарико-винтовые пары класса точности П3 обеспечивают высокую точность позиционирования и надежную работу станков, обеспечивают стабильную подачу инструмента и точное перемещение рабочих узлов при обработке деталей.
Капитальный ремонт ШВП (63х10мм. поперечная) станка С ЧПУ РТ755Ф3;Доведение ШВП до состояния нового, гарантия на ШВП 6 месяцев, разборка ШВП, рихтовка вала, резьбошлифовка, изготовление новых гаек, восстановление/замена корпуса гаек, замена шариков, сборка ШВП, испытание, консервация. Технология ремонта и модернизации ШВП включает в себя: перешлифовку спецрезьбы и шеек винта ШВП при сохранении закаленного слоя, изготовление новой спецгайки, замену втулок вкладышей, корпуса спецгайки, шариков. Все точностные параметры восстановленной ШВП соответствуют новому из
Капитальный ремонт ШВП (80х10мм. Шарико-винтовой пары);Капитальный ремонт шарико-винтовой пары предназначен для восстановления и регулировки износившейся передачи в системах позиционирования станков с числовым программным управлением. Включает полную разборку, очистку, замену изношенных деталей и регулировку.
Клиновые опоры (чугун) исполнение 110,130,140;Клиновые опоры изготавливаются в исполнениях 110, 130, 140 (чугун) имеют две составные части, используются для установки станков и другого промышленного оборудования непосредственно на фундамент, имеют регулировочные болты с площадкой для выставки и регулировки основания станин оборудования на фундаменте. Имеют различную грузоподъемность в зависимости от устанавливаемого на них оборудования. Исполнение 110 - длина опоры 240мм, грузоподъемность до 2500кгс. Исполнение 130 - длина опоры 300мм, груз
Клиновые ремни для промышленного оборудования;Применяются в токарных фрезерных сверлильных, шлифальных станках и другом промышленном оборудовании для передачи вращательного движения от приводов оборудования (главного двигателя, двигателей) на шпинделя, и другие узлы промышленного оборудования. Имеют различные длины и конфигурацию. Поставляются в зависимости от мощности используемого оборудования и его технических характеристик.
Клинья для станков мод. 1М63;Клинья предназначены для регулировки зазоров в направляющих каретки и суппорта станка. Обеспечивают точное выравнивание и исключение люфтов при передаче движения от ходового винта к подвижным узлам станка.
Клинья для станков мод. ИР1250;Производство и поставка клиньев для станков, применяются в различных конструктивных вариантах и различных конструкционных деталей станочных узлов и механизмов.
Колесо зубчатое УГ9311.0200.057 для револьверной головки УГ9326;Колесо зубчатое УГ9311.0200.057 предназначено для трансмиссии револьверной головки УГ9326 станков с ЧПУ. Обеспечивает передачу крутящего момента при индексировании инструмента и автоматическом переключении позиций.
Кольца пружинные для токарных станков и промышленного оборудования;Кольца пружинные применяются в токарных станках и промышленном оборудовании для фиксации и удержания компонентов на валах и осях. Изделия обеспечивают надежное крепление деталей и предотвращают их смещение при работе оборудования. Кольца пружинные изготавливаются из высокопрочной стали и обеспечивают длительный срок эксплуатации, надежность функционирования и стабильность всей системы при выполнении различных операций обработки и обслуживания станочного оборудования.
Комплект кулачков (3шт.) 3-250.35.11.004 для патрона ф.250мм.;Комплект кулачков в количестве 3 штук модель 3-250.35.11.004 предназначен для использования в патронах диаметром 250мм токарных станков. Кулачки служат для надежного крепления и позиционирования обрабатываемых деталей. Изделия изготавливаются из высокопрочной стали с особой закалкой и обеспечивают надежную фиксацию заготовок, точное центрирование и стабильную работу механизма зажима при выполнении различных операций обработки деталей.
Комплект роликов (в сборе) для неподвижного люнета станков 1М63Н;Комплект роликов предназначен для сборки неподвижного люнета и служит для поддержки и направления обрабатываемой детали при выполнении операций точения. Обеспечивает точное центрирование и исключает биение длинных деталей при высокой частоте вращения.
Комплект секторов с пружинами резцедержателей токарно-винторезного станка модели 16К20;Комплект секторов с пружинами предназначен для закрепления и фиксации резца в резцедержателе токарного станка. Обеспечивает надежное удержание инструмента при выполнении различных операций обработки деталей и предотвращает его смещение под нагрузкой.
Комплектующие для люнетов башмаки ролики вилки;Комплектующие для люнетов предназначены для сборки и функционирования люнетов токарных станков. Включают башмаки для направления, ролики для поддержки детали и вилки для закрепления конструкции при обработке длинных валов.
Конические пары с прямым и круговым зубом до 6 класса точности до m-26;Конические пары зубчатых колес предназначены для передачи крутящего момента между пересекающимися валами на различных станках. Изготавливаются с прямым и круговым профилем зуба с точностью до 6 класса и модулем до m-26.
Конические прижимы инструмента револьверных головок 1П756ДФ3.40.000 и 1П756ДФ3.39.000;Конические прижимы предназначены для надежного крепления и ориентирования режущего инструмента в позициях револьверной головки станка с числовым программным управлением. Обеспечивают точное центрирование и удержание инструмента при работе.
Конические шестерни 16К40 (ползушка);Конические шестерни для ползушки станка модели 16К40 предназначены для передачи крутящего момента между валами, расположенными не параллельно друг другу. Коническая передача состоит из двух зубчатых колес - ведущего и ведомого, установленных под углом. Данный тип передачи применяется при необходимости изменения направления вращения или распределения мощности. Шестерни изготавливаются из высокопрочной стали и обеспечивают стабильную работу механизма подач станка при обработке деталей.
